ポストID,日付,ポスト本文,ポストのリンク,インプレッション数,いいね,エンゲージメント,ブックマーク,共有された回数\,新しいフォロー,返信,リポスト,プロフィールへのアクセス数,詳細のクリック数,URLのクリック数,ハッシュタグのクリック数,パーマリンクのクリック数
2043249857054613952,"Sun, Apr 12, 2026",大手ゼネコン4社（竹中工務店・鹿島建設・大林組・フジタ）が建設ロボットのソフトウェア標準化に共同で着手した。建設RXコンソーシアムの枠組みで、資材自動搬送・風量測定・耐火被覆吹付け・汎用移動ロボットの4種類が対象。NEDOの研究開発事業とも連携してる。 https://t.co/wUzkunDhVU,https://x.com/akionionio/status/2043249857054613952,280,3,8,0,0,0,0,0,2,0,0,0,0
2043156942387122552,"Sun, Apr 12, 2026",激しく同意。 建設業を「底辺」と呼ぶ奴は、自分が住む家の基礎がどうやって作られたか、一回でも考えたことあるか？ 俺は建設×AIで仕事してるが、現場の人間の「手と頭と経験」が、どれほど非凡かを毎日痛感してる。 AIが図面を描いても、コンクリートを打つのは人間や。,https://x.com/akionionio/status/2043156942387122552,281,3,16,0,0,0,0,1,2,10,0,0,0
2043137284531486975,"Sun, Apr 12, 2026",建設業は在庫を大量に持てない構造。発注してから届くまでの期間で工程を組んでるから、供給が止まった瞬間に現場も止まる。 特に15人以下の専門工事会社は在庫バッファがほぼゼロ。1ヶ月供給が途絶えたら資金繰りが詰まる。元請と下請で影響が非対称なのが今回の問題の本質だと思う。,https://x.com/akionionio/status/2043137284531486975,184,1,4,0,0,0,0,0,1,2,0,0,0
2043133215649788169,"Sun, Apr 12, 2026","建設業の採用広告費って平均いくらか知ってるだろうか。 人材紹介の手数料を払って、求人広告を出して、それでも応募が来ない会社が大半。一方で新光重機はXで65,000フォロワーを集めて採用応募が増えた。大高建設は14,000フォロワーでSNS経由の採用実績がある。 https://t.co/q5F0Wcdqoq",https://x.com/akionionio/status/2043133215649788169,103,1,7,0,0,0,0,0,3,2,0,0,0
2042924758405386307,"Sat, Apr 11, 2026",日経の詳報はこちら。清水は中期経営計画で建設DX・海外・エンジニアリングの3本柱を外部成長戦略として打ち出してる。AEC買収はその海外（特殊マーケット）の実装。 https://t.co/Q5KDIT4BmJ,https://x.com/akionionio/status/2042924758405386307,98,0,7,0,0,0,0,0,0,4,3,0,0
2042920685312655388,"Sat, Apr 11, 2026","清水建設が沖縄の建設会社American Engineering Corporation（AEC）を完全子会社化する。AECは1964年デラウェア州で設立、従業員1,200人超、2025年12月期の売上は約500億円。主力は在日米軍基地の工事と、外資系企業が発注するデータセンター建設。沖縄を主要拠点にグアムまでカバーしてる。 https://t.co/hiGiM0MPTN",https://x.com/akionionio/status/2042920685312655388,322,0,8,1,0,0,1,0,2,1,0,0,0
2042845436457947221,"Sat, Apr 11, 2026",LIXILの供給条件調整は建設現場に直撃する。サッシの納期が読めなくなると工程全体に影響が出る。中東リスクが建設業のサプライチェーンに波及する構図は今後も繰り返されそう。,https://x.com/akionionio/status/2042845436457947221,380,4,17,1,0,0,0,3,3,7,0,0,0
2042810397217173769,"Sat, Apr 11, 2026",設計は4社JV（JR東日本建築設計・JR東日本コンサルタンツ・日本設計・日建設計）。SNSで隈研吾氏の設計と拡散されてるけどJR東側・隈氏側双方が否定してる。,https://x.com/akionionio/status/2042810397217173769,255,1,4,0,0,0,0,0,2,1,0,0,0
2042809961240248625,"Sat, Apr 11, 2026",産経ニュースの詳報。設計者の誤情報も訂正されてる。 BIMでの動線シミュレーションが設計段階で標準化されれば、利用開始後に気づくような問題は大幅に減らせると思う。,https://x.com/akionionio/status/2042809961240248625,37,0,0,0,0,0,0,0,0,0,0,0,0
2042809960103580077,"Sat, Apr 11, 2026",高輪ゲートウェイシティの大階段で複数のけが人が出ている。原因は目の錯覚。中央のベンチ部分と両サイドの階段の境界が上から見分けにくく、足を踏み外して転倒する。JR東日本はチェーンで応急対策を施した。,https://x.com/akionionio/status/2042809960103580077,225,1,5,0,0,0,1,0,1,2,0,0,0
2042769535892361319,"Sat, Apr 11, 2026",NHK解体キングダムは今夜21:00放送。万博大屋根リングの解体に密着。木材の中には被災地・福島にまつわるエピソードもあるらしい。 欧州ではDfD（Design for Disassembly）が設計段階で組み込まれてるけど、日本はまだこれから。,https://x.com/akionionio/status/2042769535892361319,56,0,0,0,0,0,0,0,0,0,0,0,0
2042769534101393912,"Sat, Apr 11, 2026","今夜NHK解体キングダムで万博大屋根リングの解体が放送される。ギネス世界記録の世界最大級木造建築。木材は住宅1,000棟分。日本の伝統工法・貫工法で組まれている。 https://t.co/hBJQfVe5mG",https://x.com/akionionio/status/2042769534101393912,103,2,4,0,0,0,1,0,1,0,0,0,0
2042592012961222722,"Fri, Apr 10, 2026",建設経済研究所の予測詳細。民間住宅も4.6%増、民間非住宅も5.5%増。全方位で伸びてる。 https://t.co/r2NdXENlXc,https://x.com/akionionio/status/2042592012961222722,54,0,0,0,0,0,0,0,0,0,0,0,0
2042592011442909446,"Fri, Apr 10, 2026",建設経済研究所の最新予測で、2026年度の建設投資は80.7兆円。前年度比5.3%増で過去最高水準に迫る。国土強靱化実施中期計画の本格始動で、公共投資だけで28.7兆円（8.9%増）。,https://x.com/akionionio/status/2042592011442909446,83,0,3,0,0,0,1,0,2,0,0,0,0
2042439974428295518,"Fri, Apr 10, 2026",日経クロステックの詳報はこちら。中・大規模建築物への展開も視野に入ってる。 https://t.co/enND72m6WB,https://x.com/akionionio/status/2042439974428295518,62,1,1,0,0,0,0,0,0,0,0,0,0
2042438941719331178,"Fri, Apr 10, 2026",国交省が建設3Dプリンター向けの建築基準法を緩和する方針を固めた。延べ面積200m²以下の平屋であれば、モルタル造形の型枠を構造部材に使う際に、建築物ごとの大臣認定が不要になる。2026年度中に関連告示が整備される見通し。 https://t.co/zPgW2ijUkl,https://x.com/akionionio/status/2042438941719331178,131,2,5,0,0,0,1,0,1,1,0,0,0
2042397848592138678,"Fri, Apr 10, 2026",これは本当にそう思う。 施工計画書を何百件も見てきたけど、「建てる手順」は細かく書いてあるのに「解体・分解の手順」はほぼ白紙という現場が大半。,https://x.com/akionionio/status/2042397848592138678,4450,15,74,5,1,1,0,10,18,30,0,0,0
2042197087446851950,"Thu, Apr 9, 2026",建設業務の有料職業紹介が原則禁止されている根拠は職業安定法第32条の11。港湾運送と建設業だけが対象。 この規制の見直し議論も始まってるけど、まだ動きは鈍い。制度を変えるか、制度の外で回る仕組みを作るか。どちらかが必要だ。,https://x.com/akionionio/status/2042197087446851950,171,1,1,0,0,0,0,0,0,0,0,0,0
2042195836340494556,"Thu, Apr 9, 2026",建設業の人手不足倒産が過去最多ペースで増えてる。でも意外と知られてない事実がある。建設技能者（大工・鳶・鉄筋工など）は、有料の人材紹介が法律で原則禁止されてる。 職業安定法の規定で、建設業務への有料職業紹介は認められていない。全国でも認定団体はたった3つしかない。,https://x.com/akionionio/status/2042195836340494556,433,2,7,0,0,0,1,0,1,3,0,0,0
2042174436707819900,"Thu, Apr 9, 2026",改正建設業法の労務費に関する詳細はこちら。著しく低い労務費での見積もりは、国交省の集中調査対象になる。 中小の下請けこそ、この仕組みを知っておくべきだと思う。,https://x.com/akionionio/status/2042174436707819900,72,0,0,0,0,0,0,0,0,0,0,0,0
2042173461230133525,"Thu, Apr 9, 2026",全国鉄筋工事協会の会長が、労務費を削る建設会社は通報で現場退場になると明言した。背景にあるのは2025年12月に全面施行された改正建設業法。 3つの新ルールが入った。 ①著しく低い労務費での見積もり禁止 ②請負代金の不当な減額禁止 ③工期ダンピングの禁止 https://t.co/DGW6JddqZ5,https://x.com/akionionio/status/2042173461230133525,143,0,3,0,0,0,1,0,1,0,0,0,0
2042043562410569735,"Thu, Apr 9, 2026",この191件の中身が重要で、最近増えてるのは「仕事はあるのに回せなくて潰れる」パターン。 受注残を抱えたまま人が確保できず、工期遅延→違約金→資金ショート。従来の不況型倒産とは構造が違う。,https://x.com/akionionio/status/2042043562410569735,383,2,5,0,0,0,0,0,0,3,0,0,0
2041834794028560503,"Wed, Apr 8, 2026",日経の調査で、大手・中堅建設会社の7割が「2026年度内は大型工事を新規受注できない」と回答した。人手不足が成長投資を阻んでいるという文脈で報じられてる。,https://x.com/akionionio/status/2041834794028560503,147,1,5,0,0,0,0,0,2,2,0,0,0
2041834698696225085,"Wed, Apr 8, 2026",選別受注に成功してる建設会社の共通点は「断る基準」を数字で持ってること。粗利率○%以下は取らない、工期○ヶ月未満は断る、みたいなルール。直感じゃなくてデータで判断してる。 ソース: https://t.co/UXhrSqs1HU,https://x.com/akionionio/status/2041834698696225085,68,0,2,0,0,0,0,0,0,0,2,0,0
2041815833106899175,"Wed, Apr 8, 2026",うちもAI開発してるから思うけど、建設業でAIが最初に変えるのは設計の上流工程だと思う。施工現場のAI化は物理的な制約が多いけど、設計はデジタル完結するから速い。 ソース: https://t.co/NvCKOzCvlK,https://x.com/akionionio/status/2041815833106899175,773,8,223,3,0,1,0,1,12,115,86,0,0
2041814629190660574,"Wed, Apr 8, 2026",日経クロステックが「AIが建築設計を変える」特集を組んだ。Autodeskが2026年から商用提供する「Forma Building Design」は、ボリューム入力だけで柱割・コア配置・外装を自動生成する。ザハ・ハディド出身のティム・フー氏はAI設計で設計期間を50%短縮した。 https://t.co/dl953BlKhm,https://x.com/akionionio/status/2041814629190660574,11953,41,334,32,6,8,1,7,40,107,0,0,0
2041471881438773617,"Tue, Apr 7, 2026",4月第2週。建設会社の新入社員がそろそろ現場配属される頃。 厚労省の雇用動向調査によると、他産業から建設業への転職が前年比40.3%増。一方で60歳以上の建設業からの離職は182.7%増。入ってくる人がいても、教える人がいなくなってる。 https://t.co/xK4JA4zCX2,https://x.com/akionionio/status/2041471881438773617,139,1,4,0,0,0,1,0,0,0,0,0,0
2041354032623878155,"Tue, Apr 7, 2026",日建連の取り組み詳細はこちら https://t.co/RvK428fLQV,https://x.com/akionionio/status/2041354032623878155,62,2,6,0,0,0,0,0,0,2,2,0,0
2041352920395084099,"Tue, Apr 7, 2026",日建連が今月から「週休二日推進本部」を「作業所閉所推進本部」に改称した。名前が変わっただけじゃない。目標が「4週8休」から「土日祝日一斉閉所」にステップアップしてる。 https://t.co/6IqqNqAeHU,https://x.com/akionionio/status/2041352920395084099,129,2,5,0,0,0,1,0,2,0,0,0,0
2041316023308353550,"Tue, Apr 7, 2026",CCUS、入札で評価・成績評定で加点。やらないと不利になる時代に入った。 ただ正直、中小の現場は「そんな暇ない」が本音だと思う。タッチ→記録→確認の手間が、1現場に何人もいると地味に重い。制度の方向性は正しいけど、運用の負荷を下げないと「登録だけして使ってない」会社が増えるだけ。,https://x.com/akionionio/status/2041316023308353550,315,3,9,0,0,0,0,0,3,3,0,0,0
2041109034800210165,"Mon, Apr 6, 2026",建設業の現場には「親分・子分」の文化がまだ色濃く残ってる。 口は悪いけど面倒見はいい親方。「俺の背中見て覚えろ」の世界。ベテランの親方が若手の失敗を自分の責任として処理してるケースは山ほど見てきた。 https://t.co/XdHvUZajHh,https://x.com/akionionio/status/2041109034800210165,116,1,6,0,0,0,2,0,0,1,0,0,0
2040992564577464743,"Mon, Apr 6, 2026",これ、肌で感じる。 巨大産業且つ国のインフラを支えてるのに、補助金も産業用地も「ものづくり＝製造業」が優先。 建設業は後回し。 国交省が「真に経営力のある産業」を目指すと言ってるけど、経営力を育てる土壌（補助金・産業誘致・税制優遇）の設計自体が製造業仕様のまま。,https://x.com/akionionio/status/2040992564577464743,1466,7,21,2,0,0,0,2,5,7,0,0,0
2040992095222288816,"Mon, Apr 6, 2026",国交省のとりまとめ全文はこちら https://t.co/EqeE1U2WB4,https://x.com/akionionio/status/2040992095222288816,48,1,4,0,0,0,0,0,0,0,3,0,0
2040990151778959545,"Mon, Apr 6, 2026",国交省が「今後の建設業政策のあり方に関する勉強会」のとりまとめを公表した。目指す姿は3つ。「人を大事にする産業」「真に経営力のある産業」「未来に続く産業」。 具体策として月給制への転換、事業承継サポート強化、経営事項審査の見直しが挙がってる。 https://t.co/w0WFsvJITF,https://x.com/akionionio/status/2040990151778959545,107,4,10,0,0,0,2,0,0,3,0,0,0
2040987921818546235,"Mon, Apr 6, 2026",国交省が「今後の建設業政策のあり方に関する勉強会」のとりまとめを公表した。目指す姿は3つ。「人を大事にする産業」「真に経営力のある産業」「未来に続く産業」。 具体策として月給制への転換、事業承継サポート強化、経営事項審査の見直しが挙がってる。 https://t.co/QuQxmQne0z,https://x.com/akionionio/status/2040987921818546235,110,6,8,0,0,0,1,0,0,1,0,0,0
2040945347091153330,"Mon, Apr 6, 2026",建設業の自動化は大手が先行してるけど、中小にも波及するタイミングが近づいてる。OPERAのような汎用システムが出てきたのがその証拠。 ソース（4/3 日経クロステック）: https://t.co/YUZu6wMRiP,https://x.com/akionionio/status/2040945347091153330,122,1,9,0,0,0,0,0,0,3,5,0,0
2040945293613777375,"Mon, Apr 6, 2026",国交省が「フィジカルAI」のピッチイベントを開催した。104組織・253名が参加。建設業界での注目度の高さがわかる。 フィジカルAIとは、センサーで外部環境を取得・判断し、建設現場で物理的な作業を省人化する技術のこと。鹿島のダム自動施工や大成のVR遠隔操作が代表例だ。,https://x.com/akionionio/status/2040945293613777375,188,2,7,1,0,0,1,0,1,3,0,0,0
2040631026842824823,"Sun, Apr 5, 2026",これ、建設業の人間が一番共感するやつ。 うちが支援してる現場の職人さんも同じこと言う。「俺が作ったビル、毎日通勤で見るけど誰も知らない」って。でもそれを誇りにしてるんだよな。,https://x.com/akionionio/status/2040631026842824823,1389,7,28,1,0,0,0,2,5,14,0,0,0
2040570950933242245,"Sat, Apr 4, 2026",建設資材の原料にもナフサは直結する。 6割→8割まで回復、4ヶ月分の在庫確保は正直ほっとした。 ただ、2割不足はまだ続いている現実。 塗料・断熱材・配管など石化製品を使う建設業は 今のうちに調達計画を見直すタイミングがきてると思う。 有事の最中に動いてくれてる経産省には素直に敬意。,https://x.com/akionionio/status/2040570950933242245,533,1,5,1,0,0,0,0,1,3,0,0,0
2040558789548823026,"Sat, Apr 4, 2026",遠隔施工って聞くとSFっぽいけど、もう現実に動いてる。 大手の自動化は止まらないから、中小は中小の戦い方を考えないといけない。うちが支援してる建設会社では、まず安全書類と日報のAI化から始めて、月40時間浮かせてるところがある。,https://x.com/akionionio/status/2040558789548823026,76,0,0,0,0,0,0,0,0,0,0,0,0
2040557614564860179,"Sat, Apr 4, 2026",秋田県の成瀬ダム建設現場で、鹿島建設が14台の建機を400km離れた神奈川県小田原から遠隔で自動運転させている。 操作するのはたった3人の「ITパイロット」。ダンプ、ブルドーザー、振動ローラーが連携して、24時間休まずCSG材を打設し続ける。現場に人がほぼいない状態で、ダムが出来上がっていく。 https://t.co/dzPFoM9Y6F,https://x.com/akionionio/status/2040557614564860179,276,3,9,0,0,0,1,0,1,3,0,0,0
2040385149364543607,"Sat, Apr 4, 2026",だからこそ、事務まわりを外注やAIで効率化して、社長と職人が本業に集中できる環境を作るのが大事だと思ってる。,https://x.com/akionionio/status/2040385149364543607,85,0,0,0,0,0,0,0,0,0,0,0,0
2040383889982808107,"Sat, Apr 4, 2026",公共工事は腕があれば取れると思われがち。 実際は経審の点数、技術者の配置、過去の実績、地域要件。全部揃えないとスタートラインにすら立てない。腕のいい職人が何人いても、書類が揃わなければ入札すらできない。 技術で勝負したい会社ほど、事務の体力がいる。,https://x.com/akionionio/status/2040383889982808107,139,0,1,0,0,0,1,0,0,0,0,0,0
2040312966105702415,"Sat, Apr 4, 2026",資材値上げが全部ナフサという1つの原料に繋がってることを知ってる人は少ない。 うちのクライアントでも3ヶ月前の見積もりをやり直すケースが増えてる。 ソース（3/31 毎日新聞）: https://t.co/mfzoN6jEKc,https://x.com/akionionio/status/2040312966105702415,363,0,8,1,0,0,0,0,1,2,5,0,0
2040312802389495925,"Sat, Apr 4, 2026",今、建設資材の値上げが止まらない。しかもバラバラに起きてるように見えて、全部1つの原因で繋がっている。 日本ペイント: シンナー75%値上げ（3月19日〜） カネカ: 断熱材「カネライトフォーム」40%値上げ（4月1日〜） デュポン・スタイロ: 断熱材40%値上げ（5月1日〜） LIXIL:,https://x.com/akionionio/status/2040312802389495925,1395,3,31,0,0,0,2,2,9,15,0,0,0
2040302935947800648,"Sat, Apr 4, 2026",解体屋ゲン、建設業の漫画としてもっと知られるべき。現場のリアルがちゃんと描かれてるのがいい。うちの社員にも勧めてます。,https://x.com/akionionio/status/2040302935947800648,793,9,21,1,0,0,0,3,4,5,0,0,0
2040302303610331384,"Sat, Apr 4, 2026",完成したら誰もこの過程を知らない。これが建設業の本質だと思う。 何百人もの職人が何年もかけて作ったものを、利用者は「便利だな」の一言で通り過ぎる。それでも黙々と作り続ける。この業界にいると、そういう人たちをもっと世の中に知ってほしいと思う。,https://x.com/akionionio/status/2040302303610331384,434,3,14,0,0,1,0,1,5,4,0,0,0
2040264354768269767,"Sat, Apr 4, 2026",建設業特化でBPOやってると、倒産の兆候が見える瞬間がある。支払いサイトが延びる、現場の人員要請が急に増える、社長が現場に出なくなる。 数字の裏にはリアルがある。,https://x.com/akionionio/status/2040264354768269767,109,0,0,0,0,0,0,0,0,0,0,0,0
2040263130459365592,"Sat, Apr 4, 2026",BPOで人を送る側としては、閉所期間中の人員の稼働先をどう確保するかが最大の課題になる。 逆に言えば、閉所しない現場に人が集中するから、繁忙期の人材確保がさらに難しくなる。準備してる会社が勝つ。,https://x.com/akionionio/status/2040263130459365592,69,1,3,0,0,0,0,0,0,2,0,0,0
2040263120355275181,"Sat, Apr 4, 2026","生き残る会社は2パターンあると思ってる。 1つは固定費を変動費に変える会社。正社員を抱え込まず、繁閑に合わせて外部リソースを使う。もう1つはDXで間接コストを圧縮する会社。書類作成や工程管理にかかる時間を削って、施工に集中する。 2,021件の裏側には、変われなかった理由がある。",https://x.com/akionionio/status/2040263120355275181,80,1,1,0,0,0,0,0,0,0,0,0,0
2040263118555873421,"Sat, Apr 4, 2026",特徴的なのは、受注は増えてるのに潰れてること。 原油高で資材が上がり、人件費も上がり、でも元請からの単価は据え置き。売上が立っても利益が出ない。建設業法改正で著しく低い労務費は禁止されたが、施行から4ヶ月で現場に浸透しているかは疑問だ。,https://x.com/akionionio/status/2040263118555873421,90,1,2,0,0,0,1,0,0,0,0,0,0
2040263117368889568,"Sat, Apr 4, 2026","2025年の建設業倒産は2,021件。過去10年で最多を更新した。 内訳を見ると構造がわかる。 ・物価高倒産: 240件 ・後継者難: 120件 ・人手不足: 113件 帝国データバンクによれば、総合工事業は35社に1社が倒産リスクを抱えている。",https://x.com/akionionio/status/2040263117368889568,218,2,5,0,0,0,2,0,1,0,0,0,0
2040263107302526989,"Sat, Apr 4, 2026",これは現場を知ってる人にしか書けない話。 BPOで建設会社に入ってると、資材の確保力がそのまま会社の信用力になってるのを実感する。安定発注してる会社は納期も価格も優遇されてて、スポットで買う会社は後回しにされる。 結局、目先のコストカットで取引先を変える会社ほど、有事に詰む。,https://x.com/akionionio/status/2040263107302526989,1123,15,45,2,0,3,0,4,11,12,0,0,0
2040195158525067447,"Fri, Apr 3, 2026",鴻池組が業界初の酷暑対策ロードマップを発表した。週休3日制、サマータイム、8月に3週間の集中閉所。WBGT33度以上で作業中止。 背景には熱中症死亡者数がある。建設業は全産業ワーストで、猛暑日が年間40日を超える中、空調服とスポドリだけでは限界がきている。,https://x.com/akionionio/status/2040195158525067447,252,2,8,0,0,0,1,0,2,3,0,0,0
2040022783548358747,"Fri, Apr 3, 2026",書類や日報をAIに任せて、監督が判断に集中できる環境を作る。効率化の本当の目的はそこだと思ってる。,https://x.com/akionionio/status/2040022783548358747,83,0,0,0,0,0,0,0,0,0,0,0,0
2040022773842759994,"Fri, Apr 3, 2026",3Dプリンター建設は職人がいなくなるから仕方なくじゃなくて、できなかったことができるようになる方向に進化してると思う。 自由曲面の壁、現場打ちじゃ無理だった形状が作れる。技術の進化としてワクワクする。,https://x.com/akionionio/status/2040022773842759994,77,0,2,0,0,0,0,0,2,0,0,0,0
2040021529849925832,"Fri, Apr 3, 2026",現場監督が一番キツいのは判断の数。 配管が干渉してる、職人が来ない、天気が変わった。全部その場で決める。1日50回以上。マニュアル通りにいく日はない。 AIで書類は楽になる。でもあの判断だけは人間にしかできない。,https://x.com/akionionio/status/2040021529849925832,102,1,6,0,0,0,1,0,3,1,0,0,0
2040021520190427420,"Fri, Apr 3, 2026",東大がスーパーゼネコンを含む6社と3Dプリンター建設の連携講座を立ち上げた。 大林組、鹿島、清水建設。名前を見ればわかるが、業界の最大手が揃い踏みだ。 3年間かけて材料特性の標準化から設計手法の確立まで取り組む。,https://x.com/akionionio/status/2040021520190427420,352,1,4,0,0,0,1,0,0,2,0,0,0
2039901983017255069,"Fri, Apr 3, 2026",自分もAI開発やってるけど、建設業の業務って型が決まってるものが多いからエージェント化しやすい。 見積、安全書類、日報、工程表。面倒だけど定型の仕事が一気に変わる可能性がある。,https://x.com/akionionio/status/2039901983017255069,92,2,4,0,0,0,1,0,0,1,0,0,0
2039900725023789074,"Fri, Apr 3, 2026",建設業向けクラウドとAI企業が資本業務提携し、見積管理・工程管理・現場報告など16種類のAIエージェントを共同開発する計画が発表された。2026年度中に順次リリース予定。 注目すべきはコンセプト。入力ゼロ、確認だけ。,https://x.com/akionionio/status/2039900725023789074,195,5,12,0,0,0,2,0,4,1,0,0,0
2039857641548308851,"Fri, Apr 3, 2026",見積現調の無料が「当たり前」になってるのが建設業の根深い問題。 移動費、人件費、図面読み込み。全部持ち出しで、失注したらゼロ。他の業界だとコンサル費として当然取れる内容なのに。,https://x.com/akionionio/status/2039857641548308851,651,4,14,1,0,0,0,1,2,7,0,0,0
